{
  "$schema": "./artifact-manifest.schema.json",
  "version": 2,
  "description": "Single source of truth for registered document classes: template, author and reviewer chains, workflow skill, validation, output capability, tone, structure, visuals, and release gates.",
  "workflowDefaults": {
    "validation": {
      "releaseGate": true
    },
    "outputs": {
      "formats": ["pdf", "docx", "doc", "deck", "pptx", "html", "rtf", "odt", "epub", "tex", "txt", "md", "mdx"],
      "branding": "construct"
    }
  },
  "artifacts": {
    "prd": {
      "vibeProfile": "construct-modern",
      "template": "templates/docs/prd.md",
      "primaryOwners": ["cx-product-manager"],
      "workflowSkill": "docs/prd-workflow",
      "toneDefault": "decision-forcing-direct",
      "toneAllowed": ["decision-forcing-direct", "executive-concise"],
      "structureRequirements": ["Problem", "Goals", "Success metrics", "Phases", "Risks and mitigations"],
      "visualRequirements": [
        { "id": "prd-user-flow", "check": "artifact-has-mermaid", "diagram": "flowchart" },
        { "id": "prd-metrics-table", "check": "artifact-table-has-columns", "columns": ["Metric", "Baseline", "Target"] }
      ],
      "researchProfile": "user",
      "releaseGate": {
        "structuralLint": true,
        "citationLint": true,
        "proseMinimum": 3,
        "requiredReviewers": ["cx-devil-advocate"],
        "optionalReviewers": ["cx-ux-researcher"]
      }
    },
    "prd-platform": {
      "template": "templates/docs/prd-platform.md",
      "primaryOwners": ["cx-product-manager"],
      "workflowSkill": "docs/prd-workflow",
      "toneDefault": "decision-forcing-direct",
      "toneAllowed": ["decision-forcing-direct", "executive-concise"],
      "structureRequirements": ["Problem", "Goals and non-goals", "Success metrics", "Risks and mitigations"],
      "visualRequirements": [
        { "id": "prd-platform-flow", "check": "artifact-has-mermaid", "diagram": "flowchart" },
        { "id": "prd-platform-metrics", "check": "artifact-table-has-columns", "columns": ["Metric", "Baseline", "Target"] }
      ],
      "researchProfile": "external",
      "releaseGate": {
        "structuralLint": true,
        "citationLint": true,
        "proseMinimum": 3,
        "requiredReviewers": ["cx-devil-advocate", "cx-architect"],
        "optionalReviewers": []
      }
    },
    "prd-business": {
      "template": "templates/docs/prd-business.md",
      "primaryOwners": ["cx-product-manager", "cx-business-strategist"],
      "workflowSkill": "docs/prd-workflow",
      "toneDefault": "executive-concise",
      "toneAllowed": ["executive-concise", "decision-forcing-direct"],
      "structureRequirements": ["The bet", "Market thesis", "Problem and opportunity", "Strategic goals", "Alternatives rejected"],
      "researchProfile": "market",
      "releaseGate": {
        "structuralLint": true,
        "citationLint": true,
        "proseMinimum": 3,
        "requiredReviewers": ["cx-devil-advocate"],
        "optionalReviewers": ["cx-business-strategist"]
      }
    },
    "meta-prd": {
      "template": "templates/docs/meta-prd.md",
      "primaryOwners": ["cx-product-manager", "cx-docs-keeper"],
      "workflowSkill": "docs/prd-workflow",
      "toneDefault": "decision-forcing-direct",
      "toneAllowed": ["decision-forcing-direct"],
      "structureRequirements": ["Problem", "Goals", "Principles", "Failure modes and mitigations", "Rollout"],
      "researchProfile": "external",
      "releaseGate": {
        "structuralLint": true,
        "citationLint": true,
        "proseMinimum": 3,
        "requiredReviewers": ["cx-devil-advocate", "cx-reviewer"],
        "optionalReviewers": []
      }
    },
    "adr": {
      "template": "templates/docs/adr.md",
      "primaryOwners": ["cx-architect", "cx-rd-lead"],
      "workflowSkill": "docs/adr-workflow",
      "toneDefault": "decision-forcing-direct",
      "toneAllowed": ["decision-forcing-direct"],
      "structureRequirements": ["Problem", "Decision", "Rejected alternatives", "Consequences", "Reversibility"],
      "visualRequirements": [
        { "id": "adr-context-diagram", "check": "artifact-has-mermaid", "diagram": "flowchart" }
      ],
      "researchProfile": "external",
      "releaseGate": {
        "structuralLint": true,
        "citationLint": true,
        "proseMinimum": 2,
        "requiredReviewers": ["cx-devil-advocate", "cx-reviewer"],
        "optionalReviewers": ["cx-architect"]
      }
    },
    "rfc": {
      "template": "templates/docs/rfc.md",
      "primaryOwners": ["cx-architect"],
      "workflowSkill": "docs/prd-workflow",
      "toneDefault": "decision-forcing-direct",
      "toneAllowed": ["decision-forcing-direct"],
      "structureRequirements": ["Summary", "Motivation", "Proposed design", "Risks", "Verification"],
      "visualRequirements": [
        { "id": "rfc-sequence-diagram", "check": "artifact-has-mermaid", "diagram": "sequenceDiagram" }
      ],
      "researchProfile": "external",
      "releaseGate": {
        "structuralLint": true,
        "citationLint": true,
        "proseMinimum": 3,
        "requiredReviewers": ["cx-devil-advocate", "cx-reviewer"],
        "optionalReviewers": []
      }
    },
    "rfc-platform": {
      "template": "templates/docs/rfc-platform.md",
      "primaryOwners": ["cx-architect"],
      "workflowSkill": "docs/prd-workflow",
      "toneDefault": "decision-forcing-direct",
      "toneAllowed": ["decision-forcing-direct"],
      "structureRequirements": ["Summary", "Motivation", "Proposed contract", "Risks", "Verification"],
      "visualRequirements": [
        { "id": "rfc-platform-sequence", "check": "artifact-has-mermaid", "diagram": "sequenceDiagram" }
      ],
      "researchProfile": "external",
      "releaseGate": {
        "structuralLint": true,
        "citationLint": true,
        "proseMinimum": 3,
        "requiredReviewers": ["cx-devil-advocate", "cx-reviewer"],
        "optionalReviewers": []
      }
    },
    "research-brief": {
      "template": "templates/docs/research-brief.md",
      "primaryOwners": ["cx-researcher", "cx-ux-researcher", "cx-explorer"],
      "workflowSkill": "docs/research-workflow",
      "toneDefault": "direct",
      "toneAllowed": ["direct", "pedagogical"],
      "structureRequirements": ["Sources", "Findings", "Confidence summary", "Recommendation"],
      "researchProfile": "external",
      "releaseGate": {
        "structuralLint": true,
        "citationLint": true,
        "proseMinimum": 2,
        "requiredReviewers": [],
        "optionalReviewers": ["cx-reviewer"]
      }
    },
    "evidence-brief": {
      "template": "templates/docs/evidence-brief.md",
      "primaryOwners": ["cx-product-manager", "cx-researcher", "cx-ux-researcher"],
      "workflowSkill": "docs/evidence-ingest-workflow",
      "toneDefault": "direct",
      "toneAllowed": ["direct", "executive-concise"],
      "structureRequirements": ["Sources", "What we observed", "Confidence", "Recommendation"],
      "researchProfile": "user",
      "releaseGate": {
        "structuralLint": true,
        "citationLint": true,
        "proseMinimum": 2,
        "requiredReviewers": [],
        "optionalReviewers": ["cx-devil-advocate"]
      }
    },
    "signal-brief": {
      "template": "templates/docs/signal-brief.md",
      "primaryOwners": ["cx-researcher", "cx-product-manager"],
      "workflowSkill": "docs/evidence-ingest-workflow",
      "toneDefault": "direct",
      "toneAllowed": ["direct"],
      "structureRequirements": ["Signal", "Evidence", "Counter-signal", "What would make this actionable"],
      "researchProfile": "user",
      "releaseGate": {
        "structuralLint": true,
        "citationLint": true,
        "proseMinimum": 1,
        "requiredReviewers": [],
        "optionalReviewers": []
      }
    },
    "runbook": {
      "template": "templates/docs/runbook.md",
      "primaryOwners": ["cx-sre", "cx-operations"],
      "workflowSkill": "docs/runbook-workflow",
      "toneDefault": "blameless",
      "toneAllowed": ["blameless", "direct"],
      "structureRequirements": ["Alert trigger", "Symptoms", "Impact", "Severity and response", "Diagnostic steps", "Remediation", "Rollback", "Escalation"],
      "visualRequirements": [
        { "id": "runbook-diagnostic-flowchart", "check": "artifact-has-mermaid", "diagram": "flowchart" }
      ],
      "researchProfile": null,
      "releaseGate": {
        "structuralLint": true,
        "citationLint": false,
        "proseMinimum": 2,
        "requiredReviewers": [],
        "optionalReviewers": ["cx-sre"]
      }
    },
    "incident-report": {
      "template": "templates/docs/incident-report.md",
      "primaryOwners": ["cx-sre", "cx-operations"],
      "workflowSkill": "docs/runbook-workflow",
      "toneDefault": "blameless",
      "toneAllowed": ["blameless"],
      "structureRequirements": ["Summary", "Severity rationale", "Impact", "Timeline", "Trigger", "Root cause", "Contributing factors", "Action items"],
      "visualRequirements": [
        { "id": "incident-timeline-table", "check": "artifact-table-has-columns", "columns": ["Time (UTC)", "Event"] }
      ],
      "researchProfile": null,
      "releaseGate": {
        "structuralLint": true,
        "citationLint": false,
        "proseMinimum": 2,
        "requiredReviewers": [],
        "optionalReviewers": ["cx-devil-advocate"]
      }
    },
    "postmortem": {
      "template": "templates/docs/postmortem.md",
      "primaryOwners": ["cx-sre"],
      "workflowSkill": "docs/runbook-workflow",
      "toneDefault": "blameless",
      "toneAllowed": ["blameless"],
      "structureRequirements": ["Summary", "Severity rationale", "Impact", "Timeline", "Trigger", "Root cause", "Contributing factors", "Action items"],
      "visualRequirements": [
        { "id": "postmortem-timeline-table", "check": "artifact-table-has-columns", "columns": ["Time (UTC)", "Event"] }